{
  "license": "https://www.apache.org/licenses/LICENSE-2.0",
  "$schema": "https://json-schema.org/draft/2020-12/schema",
  "$id": "https://w3id.org/battinfo/schema/material-spec.schema.json",
  "title": "BattINFO Material Spec",
  "description": "Reusable specification of a battery material (e.g. graphite, LFP, NMC811, PVDF, carbon black). The 'spec' half of the spec+instance pair; a material instance is a physical lot/batch realizing this spec.",
  "type": "object",
  "additionalProperties": false,
  "required": [
    "schema_version",
    "material_spec",
    "provenance"
  ],
  "properties": {
    "schema_version": {
      "type": "string",
      "pattern": "^\\d+\\.\\d+\\.\\d+(-[A-Za-z0-9.-]+)?$",
      "description": "Version of the record schema this document conforms to (semantic versioning); stamped by the library on save."
    },
    "material_spec": {
      "type": "object",
      "additionalProperties": false,
      "required": [
        "id",
        "name"
      ],
      "properties": {
        "id": {
          "$ref": "#/$defs/MaterialSpecIri"
        },
        "short_id": {
          "$ref": "#/$defs/ShortId"
        },
        "name": {
          "type": "string",
          "minLength": 1,
          "description": "Human-readable material name / grade (e.g. 'LFP', 'Graphite', 'NMC811', 'PVDF')."
        },
        "handle": {
          "$ref": "#/$defs/Handle",
          "description": "Short readable slug, unique within one registry workspace (e.g. 'flores-ocv/graphite-aq-1-063b77-cell'). Display text, never part of the identity."
        },
        "kind": {
          "type": "string",
          "minLength": 1,
          "description": "Required Level-1 MaterialKind key from the curated material_kinds vocabulary (e.g. 'graphite', 'lfp', 'nmc811'). The aggregation axis of the Battery Genome; resolves to the kind's chemical-substance class IRI. An unknown kind is rejected at save time. See battinfo.materials.material_kind_keys()."
        },
        "grade": {
          "type": "string",
          "description": "Manufacturer grade / product version (e.g. 'grade X', 'v2'). Part of spec identity together with manufacturer and product."
        },
        "material_class": {
          "type": "string",
          "enum": [
            "active_material",
            "binder",
            "conductive_additive",
            "current_collector",
            "separator_material",
            "electrolyte_salt",
            "electrolyte_solvent",
            "electrolyte_additive",
            "metal_electrode",
            "coating",
            "thickener",
            "dispersant",
            "other"
          ],
          "description": "Deprecated in favor of the kind’s roles (the curated vocabulary lists the use-site slots a kind is known to fill): a single forced role is system-relative. Accepted for back-compat and still written by importers; slated for removal at the next record-shape version."
        },
        "electrode_polarity": {
          "type": "string",
          "enum": [
            "positive",
            "negative",
            "none"
          ],
          "description": "Deprecated, do not author: polarity is an electrode property, never a material’s — state it on the electrode or through the cell’s holders. Accepted only so existing records keep validating."
        },
        "formula": {
          "type": "string",
          "description": "Chemical formula or idealized composition (e.g. 'LiFePO4', 'C', 'Zn', '(C2H2F2)n')."
        },
        "chemistry_family": {
          "type": "string",
          "description": "Coarse chemistry family label (e.g. 'olivine', 'layered-oxide', 'spinel', 'graphitic-carbon')."
        },
        "emmo_type": {
          "type": "string",
          "description": "Optional EMMO/domain-battery class label or IRI for this material; informs JSON-LD @type."
        },
        "cas_number": {
          "type": "string",
          "description": "CAS Registry Number, when applicable."
        },
        "manufacturer": {
          "$ref": "#/$defs/OrgRef",
          "description": "Manufacturer of the item."
        },
        "supplier": {
          "$ref": "#/$defs/OrgRef",
          "description": "Supplier or vendor the item was sourced from."
        },
        "product_id": {
          "type": "string",
          "description": "Manufacturer / supplier product or grade identifier."
        },
        "composition": {
          "$ref": "#/$defs/Composition",
          "description": "Structured derivation of this grade: base material, coatings, dopants, and constituents."
        },
        "property": {
          "$ref": "modules/common/quantitative-properties.schema.json",
          "description": "Named quantity map of technical properties (snake_case key to value+unit quantity)."
        },
        "description": {
          "type": "string",
          "description": "Longer free-text description of the material."
        },
        "comment": {
          "type": "string",
          "description": "Free-text comment."
        }
      },
      "description": "The material grade being specified."
    },
    "provenance": {
      "type": "object",
      "additionalProperties": false,
      "required": [
        "source_type"
      ],
      "properties": {
        "source_type": {
          "type": "string",
          "enum": [
            "datasheet",
            "manufacturer",
            "measurement",
            "lab",
            "literature",
            "manual",
            "other"
          ],
          "description": "Kind of source this record was created from."
        },
        "source_name": {
          "type": "string",
          "description": "Human-readable name of the source (document title, instrument, lab, or system)."
        },
        "source_file": {
          "type": "string",
          "description": "Filename or path of the source file, when the record was derived from a file."
        },
        "source_url": {
          "oneOf": [
            {
              "type": "string",
              "format": "uri"
            },
            {
              "type": "null"
            }
          ],
          "description": "URL of the source document or landing page, when available."
        },
        "citation": {
          "type": "string",
          "format": "uri",
          "description": "Resolvable citation target to use for attribution, typically a DOI URL."
        },
        "citation_doi": {
          "type": "string",
          "pattern": "^10\\.\\d{4,9}/[-._;()/:A-Za-z0-9]+$",
          "description": "DOI of the source publication (bare '10.xxxx/...' form). Prefer provenance.citation with a DOI resolver URL."
        },
        "retrieved_at": {
          "$ref": "#/$defs/UnixTime",
          "description": "Unix timestamp (seconds since epoch, UTC) when the source was retrieved or the record was captured."
        },
        "file_hash": {
          "type": "string",
          "pattern": "^[A-Fa-f0-9]{64}$",
          "description": "SHA-256 hash of the source file, for integrity verification."
        },
        "workflow_version": {
          "type": "string",
          "description": "Version of the ingest/curation workflow that produced this record."
        },
        "curated_by": {
          "type": "string",
          "description": "Name or identifier of the person who curated this record."
        },
        "comment": {
          "type": "string",
          "description": "Free-text provenance comment."
        },
        "battinfo_version": {
          "type": "string",
          "pattern": "^\\d+\\.\\d+\\.\\d+(((a|b|rc)\\d+)?(\\.post\\d+)?(\\.dev\\d+)?(\\+[A-Za-z0-9.]+)?|-[A-Za-z0-9.-]+)$",
          "description": "Version of the battinfo library that wrote this record, stamped on save: X.Y.Z with an optional PEP 440 suffix (0.8.0rc1, 0.8.0.dev1, 0.8.0.post1, 0.8.0+local) or a hyphenated one (0.8.0-rc1)."
        }
      },
      "description": "Where the information in this record came from: source type, file or URL, citation, and retrieval time."
    },
    "notes": {
      "type": "array",
      "items": {
        "type": "string"
      },
      "description": "Free-text notes carried with the record."
    },
    "funding": {
      "$ref": "#/$defs/Funding"
    },
    "contributor": {
      "type": "array",
      "items": {
        "$ref": "#/$defs/Person"
      },
      "minItems": 1,
      "description": "People who contributed this record to the platform (attribution/provenance). Each is a schema:Person; an ORCID may be given in same_as. Stamped by ws.save."
    },
    "license": {
      "type": "string",
      "minLength": 1,
      "description": "License under which this record is released, as an SPDX identifier (e.g. \"cc-by-4.0\") or a URL. Stamped from the workspace default (ws.license) and emitted as dcterms:license in JSON-LD."
    }
  },
  "$defs": {
    "UnixTime": {
      "type": "integer",
      "minimum": 0,
      "description": "Unix timestamp in whole seconds since 1970-01-01T00:00:00Z."
    },
    "ShortId": {
      "type": "string",
      "pattern": "^[0-9a-hjkmnp-tv-z]{6,16}$",
      "description": "Short human-friendly identifier derived from the record IRI (Crockford base32, 6-16 characters)."
    },
    "Handle": {
      "type": "string",
      "pattern": "^[a-z0-9]+(?:-[a-z0-9]+)*(?:/[a-z0-9]+(?:-[a-z0-9]+)*)*$",
      "maxLength": 120,
      "description": "Short readable slug for this record, unique within one registry workspace and shown as <workspace>/<handle> (e.g. 'flores-ocv/graphite-aq-1-063b77-cell'). Lowercase ASCII segments joined by '/', each made of letters and digits separated by single hyphens; at most 120 characters. Display text only: the record's identity is its IRI, and a handle may be corrected without moving it. Build one with battinfo.naming.handle_for()."
    },
    "MaterialSpecIri": {
      "type": "string",
      "pattern": "^https://w3id\\.org/battinfo/(?:spec|material-spec|electrode-spec|separator-spec|electrolyte-spec|current-collector-spec|housing-spec)/[0-9a-hjkmnp-tv-z]{4}(?:-[0-9a-hjkmnp-tv-z]{4}){3}$"
    },
    "OrganizationIri": {
      "type": "string",
      "pattern": "^https://w3id\\.org/battinfo/organization/[0-9a-hjkmnp-tv-z]{4}(?:-[0-9a-hjkmnp-tv-z]{4}){3}$",
      "description": "Canonical BattINFO IRI in the organization/ namespace (https://w3id.org/battinfo/organization/xxxx-xxxx-xxxx-xxxx)."
    },
    "Organization": {
      "type": "object",
      "additionalProperties": false,
      "required": [
        "name"
      ],
      "properties": {
        "type": {
          "const": "Organization",
          "description": "JSON-LD type discriminator."
        },
        "id": {
          "$ref": "#/$defs/OrganizationIri",
          "description": "Canonical BattINFO organization IRI linking this party to its organization record."
        },
        "name": {
          "type": "string",
          "minLength": 1,
          "description": "Organization name."
        },
        "url": {
          "type": "string",
          "format": "uri",
          "description": "Homepage URL."
        },
        "same_as": {
          "type": "string",
          "format": "uri",
          "description": "External identifier IRI for this organization (e.g. ROR or Wikidata)."
        }
      },
      "description": "An organization referenced by name, with an optional canonical BattINFO organization IRI."
    },
    "OrgRef": {
      "description": "An organization, as either a plain name string or a structured Organization object that can carry a canonical organization IRI.",
      "oneOf": [
        {
          "type": "string",
          "minLength": 1
        },
        {
          "$ref": "#/$defs/Organization"
        }
      ]
    },
    "Funding": {
      "type": "object",
      "additionalProperties": false,
      "description": "Funding project (grant) under which the record was produced. Maps to schema:funding / schema:Grant in JSON-LD.",
      "required": [
        "identifier"
      ],
      "properties": {
        "type": {
          "const": "Grant"
        },
        "id": {
          "type": "string",
          "format": "uri"
        },
        "identifier": {
          "type": "string",
          "minLength": 1
        },
        "name": {
          "type": "string"
        },
        "acronym": {
          "type": "string"
        },
        "program": {
          "type": "string"
        },
        "funder": {
          "type": "object",
          "additionalProperties": false,
          "required": [
            "name"
          ],
          "properties": {
            "type": {
              "const": "Organization"
            },
            "name": {
              "type": "string",
              "minLength": 1
            },
            "url": {
              "type": "string",
              "format": "uri"
            },
            "same_as": {
              "type": "string",
              "format": "uri"
            }
          }
        }
      }
    },
    "Person": {
      "type": "object",
      "additionalProperties": false,
      "required": [
        "name"
      ],
      "properties": {
        "type": {
          "const": "Person"
        },
        "name": {
          "type": "string",
          "minLength": 1
        },
        "given_name": {
          "type": "string",
          "minLength": 1
        },
        "family_name": {
          "type": "string",
          "minLength": 1
        },
        "email": {
          "type": "string",
          "format": "email"
        },
        "url": {
          "type": "string",
          "format": "uri"
        },
        "same_as": {
          "type": "string",
          "format": "uri"
        },
        "affiliation": {
          "anyOf": [
            {
              "$ref": "#/$defs/Organization"
            },
            {
              "type": "array",
              "items": {
                "$ref": "#/$defs/Organization"
              },
              "minItems": 1
            }
          ],
          "description": "Organization(s) the person is affiliated with: one, or a list."
        }
      }
    },
    "MaterialRef": {
      "description": "Reference to another material by canonical material-spec IRI and/or a free-text name.",
      "type": "object",
      "additionalProperties": false,
      "properties": {
        "material_spec_id": {
          "$ref": "#/$defs/MaterialSpecIri",
          "description": "IRI of the material-spec record being referenced."
        },
        "name": {
          "type": "string",
          "minLength": 1,
          "description": "Free-text material name, used when no material-spec record exists."
        },
        "property": {
          "$ref": "modules/common/quantitative-properties.schema.json",
          "description": "Quantities qualifying the reference (e.g. mass_fraction, thickness)."
        }
      },
      "anyOf": [
        {
          "required": [
            "material_spec_id"
          ]
        },
        {
          "required": [
            "name"
          ]
        }
      ]
    },
    "Composition": {
      "type": "object",
      "description": "Structured composition for derived/blended materials: a base material with surface coatings, dopants, and/or constituent fractions.",
      "additionalProperties": false,
      "properties": {
        "base_material_id": {
          "$ref": "#/$defs/MaterialSpecIri",
          "description": "Parent/base material this grade derives from (e.g. base NMC811 for an Al2O3-coated grade)."
        },
        "coatings": {
          "type": "array",
          "items": {
            "$ref": "#/$defs/MaterialRef"
          },
          "description": "Surface coating layers (e.g. Al2O3), each optionally carrying its own properties (thickness, mass_fraction)."
        },
        "dopants": {
          "type": "array",
          "items": {
            "type": "object",
            "additionalProperties": false,
            "required": [
              "element"
            ],
            "properties": {
              "element": {
                "type": "string",
                "minLength": 1,
                "description": "Chemical symbol of the dopant element (e.g. 'Al', 'Zr')."
              },
              "fraction": {
                "$ref": "modules/common/quantity.schema.json",
                "description": "Dopant fraction. Use unit 'mol/mol' for a mole fraction, or unit '1' (0-1) or '%' (0-100) for a mass fraction."
              }
            }
          },
          "description": "Dopant elements with their fractions (mole fraction with unit 'mol/mol', or mass fraction with unit '1' or '%')."
        },
        "constituents": {
          "type": "array",
          "items": {
            "$ref": "#/$defs/MaterialRef"
          },
          "description": "Constituent materials of a blend/mixture, each with its mass_fraction (unit '1' or '%') under its property map."
        }
      }
    }
  }
}
