{
  "schema_version": "0.2.0",
  "material_spec": {
    "id": "https://w3id.org/battinfo/spec/r5xt-4hrh-jm2k-yg4m",
    "short_id": "r5xt4h",
    "name": "Carbon black",
    "kind": "carbon_black",
    "material_class": "conductive_additive",
    "formula": "C",
    "chemistry_family": "amorphous-carbon",
    "property": {
      "bet_surface_area": {
        "value": 62,
        "unit": "m2/g"
      },
      "true_density": {
        "value": 1.8,
        "unit": "g/cm3"
      }
    }
  },
  "provenance": {
    "source_type": "manual",
    "retrieved_at": 1781740345
  },
  "notes": [
    "Conductive carbon additive (e.g. Super P-grade).",
    "Illustrative example: values typical of this material, not taken from a datasheet or measured."
  ]
}
