{
  "schema_version": "0.2.0",
  "material_spec": {
    "id": "https://w3id.org/battinfo/spec/bkrw-7shb-tzbm-j664",
    "short_id": "bkrw7s",
    "name": "PVDF",
    "kind": "pvdf",
    "material_class": "binder",
    "formula": "(C2H2F2)n",
    "chemistry_family": "fluoropolymer",
    "property": {
      "molar_mass": {
        "value": 534000,
        "unit": "g/mol"
      },
      "true_density": {
        "value": 1.78,
        "unit": "g/cm3"
      }
    }
  },
  "provenance": {
    "source_type": "manual",
    "retrieved_at": 1781740345
  },
  "notes": [
    "Polyvinylidene fluoride binder.",
    "Illustrative example: values typical of this material, not taken from a datasheet or measured."
  ]
}
