{
  "schema_version": "0.2.0",
  "material_spec": {
    "id": "https://w3id.org/battinfo/spec/npa4-0dnw-evyh-hhdm",
    "short_id": "npa40d",
    "name": "NMC811",
    "kind": "nmc811",
    "material_class": "active_material",
    "formula": "LiNi0.8Mn0.1Co0.1O2",
    "chemistry_family": "layered-oxide",
    "manufacturer": {
      "type": "Organization",
      "name": "Canrud",
      "id": "https://w3id.org/battinfo/organization/9rfa-w6b3-dv1x-vj4z"
    },
    "property": {
      "specific_capacity": {
        "value": 200,
        "unit": "mAh/g",
        "value_basis": "Measured",
        "conditions": {
          "discharging_c_rate": {
            "value": 0.1,
            "unit": "C"
          },
          "lower_voltage_limit": {
            "value": 3.0,
            "unit": "V"
          },
          "upper_voltage_limit": {
            "value": 4.3,
            "unit": "V"
          },
          "temperature": {
            "value": 25,
            "unit": "degC"
          },
          "voltage_reference": {
            "value_text": "Li/Li+"
          }
        }
      },
      "true_density": {
        "value": 4.8,
        "unit": "g/cm3"
      },
      "average_voltage": {
        "value": 3.8,
        "unit": "V",
        "conditions": {
          "voltage_reference": {
            "value_text": "Li/Li+"
          }
        }
      }
    }
  },
  "provenance": {
    "source_type": "manual",
    "retrieved_at": 1781740345
  },
  "notes": [
    "Nickel-rich layered oxide cathode. Discovery-Benchmark NMC811-Graphite cells.",
    "Illustrative example: values typical of this material, not taken from a datasheet or measured."
  ]
}
