{
  "schema_version": "0.2.0",
  "material_spec": {
    "id": "https://w3id.org/battinfo/spec/shzh-t2jt-wwqv-k54m",
    "short_id": "shzht2",
    "name": "LCO",
    "kind": "lco",
    "material_class": "active_material",
    "formula": "LiCoO2",
    "chemistry_family": "layered-oxide",
    "manufacturer": {
      "type": "Organization",
      "name": "Canrud",
      "id": "https://w3id.org/battinfo/organization/9rfa-w6b3-dv1x-vj4z"
    },
    "property": {
      "specific_capacity": {
        "value": 150,
        "unit": "mAh/g",
        "value_basis": "Measured",
        "conditions": {
          "discharging_c_rate": {
            "value": 0.1,
            "unit": "C"
          },
          "lower_voltage_limit": {
            "value": 3.0,
            "unit": "V"
          },
          "upper_voltage_limit": {
            "value": 4.2,
            "unit": "V"
          },
          "temperature": {
            "value": 25,
            "unit": "degC"
          },
          "voltage_reference": {
            "value_text": "Li/Li+"
          }
        }
      },
      "average_voltage": {
        "value": 3.9,
        "unit": "V",
        "conditions": {
          "voltage_reference": {
            "value_text": "Li/Li+"
          }
        }
      }
    }
  },
  "provenance": {
    "source_type": "datasheet",
    "retrieved_at": 1781740345
  },
  "notes": [
    "Lithium cobalt oxide cathode. Discovery-Benchmark LCO-Graphite cells."
  ]
}
