{
  "schema_version": "0.2.0",
  "material_spec": {
    "id": "https://w3id.org/battinfo/spec/fwnh-2wkq-n9wm-fdab",
    "short_id": "fwnh2w",
    "name": "MnO2",
    "kind": "mno2",
    "material_class": "active_material",
    "formula": "MnO2",
    "chemistry_family": "manganese-oxide",
    "property": {
      "specific_capacity": {
        "value": 290,
        "unit": "mAh/g",
        "value_basis": "Measured",
        "conditions": {
          "discharging_c_rate": {
            "value": 0.1,
            "unit": "C"
          },
          "temperature": {
            "value": 25,
            "unit": "degC"
          }
        }
      },
      "true_density": {
        "value": 5.0,
        "unit": "g/cm3"
      }
    }
  },
  "provenance": {
    "source_type": "datasheet",
    "retrieved_at": 1781772766
  },
  "notes": [
    "Manganese dioxide cathode active material for alkaline Zn-MnO2 cells (synthetic reference)."
  ]
}
